{
 "slug": "doac-clip-facebook-2026-09",
 "title": "Facebook comments on the Diary of a CEO clip of Nate Soares",
 "series": "DOAC AI debate reception",
 "platform": "facebook",
 "artefact_title": "Diary of a CEO clip of Nate Soares (Facebook video; the same video is also posted as a reel)",
 "artefact_url": "https://www.facebook.com/watch/?v=2538854556526162",
 "artefact_published": "2026-09-17",
 "central_claim": "Advanced AI could become impossible for humans to control and poses a serious risk, up to human extinction, that justifies slowing or stopping development.",
 "capture_dates": [
  "2026-10-04",
  "2026-10-05"
 ],
 "capture_method": "Browser extraction of the comment section, loaded over two sessions (a run that froze, then a capped re-run) on 4 and 5 October 2026; the comment set was fixed during the re-run. The text was then re-read from the open page on the morning of 5 October (final extraction 08:50 UTC) after the first extraction came back empty. The start time of the capture is not recorded. 2,075 of the 6,700 comments Facebook reported were retrieved, because loading was capped. Publication dates are approximated from the relative time shown at capture; Facebook shows \"a week ago\" for anything a week old or older.",
 "counts": {
  "on_page_at_capture": 6700,
  "retrieved": 2075,
  "coded": 2075,
  "coded_by_coders": 2072,
  "not_sent_to_coders": 3,
  "top_level": 877,
  "replies": 1198,
  "authors": 1222,
  "clear_position_base": 1366,
  "total_likes": 9145
 },
 "spot_check": {
  "sample": 347,
  "agreed": 317,
  "checked_by": "Claude (claude-opus-5-5), independent blind second coding",
  "date": "2026-10-07",
  "note": "Pooled across the five DOAC studies: a random 347-row sample was coded a second time, blind, under codebook v2. Agreement: stance 317/347 (91.4%, kappa 0.87), frame 309/347 (89.0%, kappa 0.87), emotion 85.9%, format reaction 97.4%, mention flags 98.8%. Rows in the sample are marked spot_checked."
 },
 "coders": "Claude (claude-opus-5-5), parallel coders of about 190 comments each; rows first coded unclear, other or debater_verdict were recoded blind under codebook v2",
 "article_url": "https://commonsignals.org/cant-we-just-unplug-it-doac-ai-debate-comment-analysis",
 "findings_note_url": null,
 "version": 1,
 "changelog": [
  {
   "version": 1,
   "date": "2026-10-07",
   "note": "First release. A first pass under codebook v1 fell just short of the 90% reliability bar on stance (88.2%) and frame (88.8%). Codebook v2 defined unclear against na and added tie-breaks for debater_verdict and other; every row coded unclear, other or debater_verdict across the five DOAC studies (14,993 of 26,019) was recoded blind under it."
  }
 ],
 "licence": "CC BY 4.0 (coding and compilation; comment text remains its authors')",
 "notes": "Rows flagged cta_keyword, emoji_only, no_text or featured_messenger were not sent to coders and carry stance na, frame other, emotion neutral and every flag false; exclude them from frame shares. debater_verdict is inflated by pile-on reply threads about Andrew McAfee: under the codebook, attacking the sceptic counts as agree, so one thread can add over a hundred agree rows. Weight by thread or report top-level comments separately before quoting agree or frame shares. The post date was not recorded at capture; artefact_published assumes the clip went up on 17 September 2026, the same day as the episode and the TikTok and Shorts versions."
}
